{
  "letterhead-title": "DEPARTMENT OF THE AIR FORCE",
  "letterhead-caption": "123RD EXAMPLE SQUADRON",
  "memo-for": [
    "FIRST/OFFICE",
    "SECOND/OFFICE"
  ],
  "from-block": [
    "YOUR/SYMBOL",
    "Your Organization Name",
    "Street Address",
    "City ST 12345-6789"
  ],
  "subject": "Test Subject in Title Case - Valid Field",
  "references": [
    "Reference Document 1",
    "Reference Document 2"
  ],
  "signature-block": [
    "FIRST M. LAST, Rank, USAF",
    "Your Official Duty Title",
    "Organization (optional)"
  ],
  "body": {
    "format": "delta",
    "data": "{\"ops\":[{\"insert\":\"Hello \"},{\"insert\":\"bold\",\"attributes\":{\"bold\":true}},{\"insert\":\" and \"},{\"insert\":\"italic\",\"attributes\":{\"italic\":true}},{\"insert\":\" text!\"},{\"insert\":\"\\n\\n\"},{\"insert\":\"First item\\n\",\"attributes\":{\"list\":\"bullet\"}},{\"insert\":\"Second item\\n\",\"attributes\":{\"list\":\"bullet\"}},{\"insert\":\"Nested item\\n\",\"attributes\":{\"list\":\"bullet\",\"indent\":1}},{\"insert\":\"\\n\\n\"},{\"insert\":\"Step one\\n\",\"attributes\":{\"list\":\"ordered\"}},{\"insert\":\"Step two\\n\",\"attributes\":{\"list\":\"ordered\"}},{\"insert\":\"Step three\\n\",\"attributes\":{\"list\":\"ordered\"}},{\"insert\":\"\\n\\n\"},{\"insert\":\"This text has \"},{\"insert\":\"bold and italic\",\"attributes\":{\"bold\":true,\"italic\":true}},{\"insert\":\" formatting, plus \"},{\"insert\":\"underlined\",\"attributes\":{\"underline\":true}},{\"insert\":\" and \"},{\"insert\":\"strikethrough\",\"attributes\":{\"strike\":true}},{\"insert\":\" text.\"}]}"
  }
}
